{
  "version": 1,
  "snapshot_id": "fixture-zero-bus",
  "source_snapshot_id": "demo-source-1",
  "generated_at": "2026-10-25T23:30:00Z",
  "mode": "live",
  "election": {
    "year": 2026,
    "round": 2,
    "office": "president",
    "election_id": "6258",
    "pleito_id": "3221"
  },
  "candidates": {
    "a": {
      "id": "13",
      "name": "Candidata A"
    },
    "b": {
      "id": "22",
      "name": "Candidato B"
    }
  },
  "counting": {
    "total_sections": 10000,
    "reported_sections": 0,
    "collected_sections": 0,
    "votes_a": 0,
    "votes_b": 0,
    "valid_votes": 0,
    "generated_at": "2026-10-25T23:30:00Z",
    "source": {
      "name": "TSE",
      "area": "BR",
      "generated_raw": null
    }
  },
  "forecast": {
    "model_version": "Demonstração sintética",
    "source_snapshot_id": "demo-source-1",
    "generated_at": "2026-10-25T23:30:00Z",
    "share_a": 51.4,
    "interval": {
      "level": 0.95,
      "lower": 47.5,
      "upper": 55.3
    },
    "win_probability_a": null,
    "notes": [
      "Cenários fictícios para avaliar a apresentação; não são previsões eleitorais."
    ]
  },
  "history": []
}
